{
  "validation":{"valid":true,"errors":[],"warnings":[],"metricNames":["node_load1"],"labelNames":["instance"]},
  "status":"success","resultType":"matrix","durationMs":12,"warnings":[],
  "series":[
    {"name":"node-a:9100","labels":{"instance":"node-a:9100","job":"node-exporter"},"points":[{"timestamp":"2026-07-13T10:00:00Z","value":0.8},{"timestamp":"2026-07-13T10:05:00Z","value":0.9},{"timestamp":"2026-07-13T10:10:00Z","value":1.3},{"timestamp":"2026-07-13T10:15:00Z","value":1.7},{"timestamp":"2026-07-13T10:20:00Z","value":1.2},{"timestamp":"2026-07-13T10:25:00Z","value":1},{"timestamp":"2026-07-13T10:30:00Z","value":0.9}]},
    {"name":"node-b:9100","labels":{"instance":"node-b:9100","job":"node-exporter"},"points":[{"timestamp":"2026-07-13T10:00:00Z","value":0.5},{"timestamp":"2026-07-13T10:05:00Z","value":0.6},{"timestamp":"2026-07-13T10:10:00Z","value":0.7},{"timestamp":"2026-07-13T10:15:00Z","value":1},{"timestamp":"2026-07-13T10:20:00Z","value":0.8},{"timestamp":"2026-07-13T10:25:00Z","value":0.7},{"timestamp":"2026-07-13T10:30:00Z","value":0.6}]}
  ]
}
